gene_id	gene_name	mean_expr	sd_expr	cv
YDR455C	YDR455C              UNKNOWN                                 UNKNOWN                                 S0002863	0.0098	0.5514	55.9918
YKL186C	YKL186C   MTR2       MRNA EXPORT                             UNKNOWN                                 S0001669	-0.0074	0.4078	55.2476
YGR031W	YGR031W              UNKNOWN                                 UNKNOWN                                 S0003263	-0.0079	0.4369	55.2257
YLR358C	YLR358C              UNKNOWN                                 UNKNOWN                                 S0004350	-0.0088	0.4830	55.0834
YHR212C	YHR212C              UNKNOWN                                 UNKNOWN; IDENTICAL TO YAR060P/RAA19P    S0001255	0.0095	0.5181	54.7816
YLR309C	YLR309C   IMH1       SECRETION (PUTATIVE)                    UNKNOWN; SUPPRESSES YPT6 TS MUTATION    S0004300	0.0107	0.5762	54.0935
YOR107W	YOR107W              UNKNOWN                                 UNKNOWN; SIMILAR TO HUMAN G0/G1 SWITCH RS0005633	0.0192	1.0399	54.0872
YLR027C	YLR027C   AAT2       ASPARTATE METABOLISM                    ASPARTATE AMINOTRANFERASE,              S0004017	0.0094	0.5061	53.9775
YAR009C	YAR009C              UNKNOWN                                 UNKNOWN                                 S0000067	0.0102	0.5512	53.8736
YIL084C	YIL084C   SDS3       SILENCING                               (PUTATIVE) TRANSCRIPTIONAL REGULATOR    S0001346	0.0059	0.3119	52.8562
YGR062C	YGR062C   COX18      RESPIRATION                             REQUIRED FOR ACTIVITY OF MITOCHONDRIAL CS0003294	0.0075	0.3885	52.1015
YKL027W	YKL027W              UNKNOWN                                 UNKNOWN; SIMILAR TO E. COLI MOLYBDOPTERIS0001510	0.0083	0.4304	52.0618
YFL040W	YFL040W              UNKNOWN                                 UNKNOWN; SIMILAR TO MEMBERS OF THE SUGARS0001854	0.0117	0.5979	51.0070
YIL066C	YIL066C   RNR3       DNA REPAIR                              REPAIR-INDUCED RIBONUCLEOTIDE REDUCTASE S0001328	-0.0311	1.5754	50.6848
YML086C	YML086C   ALO1       D-ERYTHROASCORBIC ACID BIOSYNTHESIS     D-ARABINONO-1,4-LACTONE OXIDASE         S0004551	-0.0103	0.5220	50.6610
YLR464W	YLR464W              UNKNOWN                                 UNKNOWN; SIMILAR TO OTHER SUBTELOMERICALS0004456	-0.0107	0.5376	50.2716
YDL206W	YDL206W              UNKNOWN                                 UNKNOWN; SIMILAR TO TRANSPORTER PROTEINSS0002365	0.0268	1.3441	50.1917
YBR051W	YBR051W              UNKNOWN                                 UNKNOWN                                 S0000255	0.0234	1.1690	49.9243
